{
  "id": "BTI-20250524080216",
  "timestamp": "20250524080216",
  "date": "2025-05-24",
  "recommendation": "一、市场周期分析  \n当前比特币价格在105,000-112,000区间震荡，关键支撑位105,000（前低+历史密集成交区），阻力位115,000（2025年1月高点）。AHR999指标1.21处于合理估值区间（低于2025-01-20的1.60泡沫值），恐惧贪婪指数66显示中性情绪。市场处于「上升期后半段」，但未突破前高且成交量萎缩，需警惕阶段性顶部形成。\n\n二、技术指标解读  \n1. 价格趋势：过去7日价格在111,000附近横盘，20日均线（109,800）走平，5月23日单日成交量较前周下降35%  \n2. 市场估值：AHR999处于近6个月50%分位，恐惧贪婪指数较2025-01-22的84极度贪婪显著回落  \n3. 周期阶段：从2024-12-17的1.75 AHR999泡沫峰值回落，当前处于牛市中期调整阶段  \n\n三、投资决策建议  \n1. 仓位调整：维持64%仓位，保留36%现金等待突破确认  \n2. 入场/出场价位：  \n   - 加仓区间：108,500-109,500（回踩20日均线）  \n   - 减仓触发：突破115,000后分批止盈10%/15%/20%  \n3. 止损设置：严格止损103,000（较当前价预留7.5%波动空间），跌破后等待AHR999<1.0重新建仓  \n4. 获利目标：  \n   - 短期（3个月）：118,000（前高压制位）  \n   - 中期（6个月）：135,000（1.618斐波那契扩展位）  \n\n四、仓位管理追踪  \n本次建议：持有现仓位，108,500-109,500加仓10%  \n仓位变化：维持64%或增至74%（视触发加仓条件）  \n新成本基础：若加仓10%均价109,000，总成本降至89,532  \n预期回报率：按目标价135,000计算潜在回报50.8%  \n\n五、风险分析  \n1. 流动性风险：成交量持续萎缩可能引发深度回调→严格执行止损纪律  \n2. 监管风险：若恐惧贪婪指数单日暴跌>20点→立即减仓20%  \n3. 黑天鹅风险：价格跌破100,000心理关口→切换至25%防御仓位  \n\n六、未来观察指标  \n1. AHR999跌破1.0 →触发熊市预警，减仓至50%  \n2. 周收盘价>115,000 →确认突破，追加10%仓位  \n3. 恐惧贪婪指数>80 →进入极度贪婪区域，启动5%阶梯止盈  \n\n```json\n{\n  \"date\": \"2025-05-24\",\n  \"position\": 64,\n  \"position_change\": \"维持64%或增加10%\",\n  \"action\": \"持有/108,500-109,500加仓\",\n  \"entry_price\": \"108,500-109,500\",\n  \"stop_loss\": 103000,\n  \"target_short\": 118000,\n  \"target_mid\": 135000,\n  \"cost_basis\": 89532,\n  \"expected_return\": \"50.8%\",\n  \"market_cycle\": \"上升期调整阶段\",\n  \"risks\": [\"流动性萎缩\",\"监管冲击\",\"心理关口失守\"],\n  \"key_levels\": [\"105,000支撑\",\"115,000阻力\",\"100,000心理位\"]\n}\n```",
  "advice_data": {
    "date": "2025-05-24",
    "position": 64,
    "position_change": "维持64%或增加10%",
    "action": "持有/108,500-109,500加仓",
    "entry_price": "108,500-109,500",
    "stop_loss": 103000,
    "target_short": 118000,
    "target_mid": 135000,
    "cost_basis": 89532,
    "expected_return": "50.8%",
    "market_cycle": "上升期调整阶段",
    "risks": [
      "流动性萎缩",
      "监管冲击",
      "心理关口失守"
    ],
    "key_levels": [
      "105,000支撑",
      "115,000阻力",
      "100,000心理位"
    ]
  },
  "metadata": {
    "last_record_id": "BTI-20250523091737",
    "user_settings": {}
  }
}