{
  "id": "BTI-20250519080121",
  "timestamp": "20250519080121",
  "date": "2025-05-19",
  "recommendation": "一、市场周期分析  \n当前比特币价格106,456美元，处于2月高点（10.6万美元）附近震荡，AHR999（1.1256）从5月7日低点0.9626回升至中性区间，恐惧贪婪指数74（贪婪但未达极端）。价格突破前高103,000阻力后形成新支撑，上方阻力在110,000美元。市场处于上升期尾部向分配期过渡阶段，需警惕短期回调风险。\n\n二、技术指标解读  \n1. 价格趋势：近一周价格在103,000-106,500美元区间震荡，5日涨幅2.2%，未出现明显量价背离  \n2. 市场估值：AHR999处于近半年中位（历史峰值1.75），恐惧贪婪指数较1月高点（87）降温，显示市场热度可控  \n3. 周期阶段：突破前高后进入价格发现阶段，但未出现加速冲顶特征，仍属上升周期  \n\n三、投资决策建议  \n1. 仓位调整：减仓10%至50%仓位，锁定部分利润  \n2. 入场/出场价位：  \n   - 减仓区间：当前价106,456立即减仓5%，109,000再减5%  \n   - 加仓区间：跌破100,000补仓10%，95,000补仓15%  \n3. 止损设置：跌破97,500止损剩余仓位，重新入场需等AHR999<0.9  \n4. 获利目标：  \n   - 短期（3个月）：110,000（+3.3%）减仓20%  \n   - 中期（6个月）：120,000（+12.8%）清仓  \n\n四、仓位管理追踪  \n上次建议：仓位60% @97,500-99,000，止损97,500  \n本次建议：减仓至50%  \n仓位变化：60% → 50%  \n新成本基础：82,278（未实现盈利29.5%）  \n预期回报率：当前持仓潜在收益42.8%（至120,000）  \n\n五、风险分析  \n1. 顶部震荡风险：价格连续5日横盘未创新高，跌破103,000需启动防御性减仓  \n2. 流动性收缩风险：若日成交量持续低于$30亿，执行提前获利了结  \n3. 宏观政策风险：关注美联储利率决议，若实际利率>2.5%触发10%减仓  \n\n六、未来观察指标  \n1. AHR999突破1.2：触发15%减仓，该数值对应2024年12月泡沫水平  \n2. 周收盘价<100,000：启动网格补仓（每下跌3%加仓5%）  \n3. 恐惧贪婪>80：强制将仓位降至30%以下，防范极端情绪反转  \n\n```json\n{\n  \"date\": \"2025-05-19\",\n  \"position\": 50,\n  \"position_change\": \"减少10%\",\n  \"action\": \"减仓\",\n  \"entry_price\": \"106,456立即执行，109,000分批\",\n  \"stop_loss\": 97500,\n  \"target_short\": 110000,\n  \"target_mid\": 120000,\n  \"cost_basis\": 82278,\n  \"expected_return\": \"42.8%\",\n  \"market_cycle\": \"上升期\",\n  \"risks\": [\"顶部震荡风险\", \"流动性收缩风险\", \"宏观政策风险\"],\n  \"key_levels\": [\"支撑103,000\", \"阻力110,000\", \"生死线97,500\"]\n}\n```",
  "advice_data": {
    "date": "2025-05-19",
    "position": 50,
    "position_change": "减少10%",
    "action": "减仓",
    "entry_price": "106,456立即执行，109,000分批",
    "stop_loss": 97500,
    "target_short": 110000,
    "target_mid": 120000,
    "cost_basis": 82278,
    "expected_return": "42.8%",
    "market_cycle": "上升期",
    "risks": [
      "顶部震荡风险",
      "流动性收缩风险",
      "宏观政策风险"
    ],
    "key_levels": [
      "支撑103,000",
      "阻力110,000",
      "生死线97,500"
    ]
  },
  "metadata": {
    "last_record_id": "BTI-20250518080135",
    "user_settings": {}
  }
}