{
  "id": "BTI-20250504080102",
  "timestamp": "20250504080102",
  "date": "2025-05-04",
  "recommendation": "一、市场周期分析  \n当前价格在95,856美元附近震荡，AHR999指标0.9524（低于1.0的牛熊分界线），恐惧贪婪指数64（中性区间）。从2025年2月历史高点10.4万美元下跌至当前水平，已形成92,000-98,000美元的箱体震荡，关键支撑位89,500美元（前低点），阻力位98,200美元（近期高点）。数据表明市场处于牛市回调后的积累期，未出现明显过热或恐慌情绪。\n\n二、技术指标解读  \n1. 价格趋势：过去30日价格在89,500-98,200美元区间波动，30日均线（约93,800美元）走平，成交量无明显放大  \n2. 市场估值：当前AHR999处于2025年4月以来中位水平（最高1.75，最低0.629），恐惧贪婪指数较2025年1月极端贪婪（84）明显降温  \n3. 周期阶段：从2024年11月至今完成完整牛熊周期后，现进入新周期积累阶段\n\n三、投资决策建议  \n1. 仓位调整：维持60%仓位（当前持仓已高于成本价80,327美元，保留现金应对波动）  \n2. 入场/出场价位：突破98,200美元加仓20%，或回调至93,000-94,500美元加仓10%  \n3. 止损设置：严格止损89,500美元（较当前价-6.5%），破位后等待85,000美元重新建仓  \n4. 获利目标：短期目标102,000美元（+6.5%），中期目标120,000美元（+25%），达目标后每上涨5%减仓10%\n\n四、仓位管理追踪  \n本次建议：维持仓位观察突破 ｜ 仓位变化：60%→60% ｜ 新成本基础：80,327美元 ｜ 预期回报率：按目标价计算中期潜在回报49.4%\n\n五、风险分析  \n1. 假突破风险：若突破98,200美元后24小时未站稳，立即平掉加仓部分  \n2. 宏观政策风险：关注美联储利率决策，若实际利率>2%则触发10%减仓  \n3. 链上异常：若交易所BTC余额单日增幅>3%，启动对冲策略\n\n六、未来观察指标  \n1. 98,200美元阻力：有效突破且维持24小时，触发20%加仓  \n2. AHR999>1.05：估值进入过热区间，启动5%分批止盈  \n3. 恐惧贪婪指数>75：市场情绪过热，触发对冲仓位建立\n\n```json\n{\n  \"date\": \"2025-05-04\",\n  \"position\": 60,\n  \"position_change\": \"维持0%\",\n  \"action\": \"持有\",\n  \"entry_price\": \"93,000-94,500或突破98,200\",\n  \"stop_loss\": 89500,\n  \"target_short\": 102000,\n  \"target_mid\": 120000,\n  \"cost_basis\": 80327,\n  \"expected_return\": \"49.4%\",\n  \"market_cycle\": \"积累期\",\n  \"risks\": [\"假突破风险\", \"宏观政策收紧\", \"链上筹码异动\"],\n  \"key_levels\": [\"98,200（突破位）\", \"93,000（支撑位）\", \"89,500（止损位）\"]\n}\n```",
  "advice_data": {
    "date": "2025-05-04",
    "position": 60,
    "position_change": "维持0%",
    "action": "持有",
    "entry_price": "93,000-94,500或突破98,200",
    "stop_loss": 89500,
    "target_short": 102000,
    "target_mid": 120000,
    "cost_basis": 80327,
    "expected_return": "49.4%",
    "market_cycle": "积累期",
    "risks": [
      "假突破风险",
      "宏观政策收紧",
      "链上筹码异动"
    ],
    "key_levels": [
      "98,200（突破位）",
      "93,000（支撑位）",
      "89,500（止损位）"
    ]
  },
  "metadata": {
    "last_record_id": "BTI-20250503080134",
    "user_settings": {}
  }
}