{
  "id": "BTI-20250513080215",
  "timestamp": "20250513080215",
  "date": "2025-05-13",
  "recommendation": "一、市场周期分析  \n当前市场处于积累期向上升期过渡阶段。关键支撑位99,800（前低点+历史止损位），阻力位105,000（2025年3月高点）。AHR999指数1.0643处于合理估值区间（0.45-1.2），较2024年12月17日的历史峰值1.7504回调明显。恐惧贪婪指数70显示市场情绪偏向贪婪但未达极端（历史最高94），价格在102,000附近震荡蓄力。\n\n二、技术指标解读  \n1. 价格趋势：近7日价格波动收窄（104,809→102,791），形成三角整理形态，50日均线100,500构成动态支撑  \n2. 市场估值：AHR999较2025-04-20低点0.7753回升38%，但仍低于2025-02-04牛市峰值1.2818  \n3. 周期阶段：市场从2025年1月110,000+高点回调后，进入第16周震荡期，符合典型牛市中期整理特征  \n\n三、投资决策建议  \n1. 仓位调整：维持75%仓位，保留25%现金应对波动  \n2. 入场/出场价位：  \n   - 加仓区：100,500-101,500（补仓500美元）  \n   - 突破加仓：105,000确认突破追涨500美元  \n   - 减仓区：110,000（减10%）、120,000（再减15%）  \n3. 止损设置：硬止损99,800（触发后等待97,500重新建仓）  \n4. 获利目标：  \n   - 短期（3个月）：115,000（+12%）  \n   - 中期（6个月）：135,000（+31%）  \n\n四、仓位管理追踪  \n本次建议：持有核心仓位，利用震荡区间波段操作  \n仓位变化：75%→75%（若触发加仓条件最高增至85%）  \n新成本基础：82,278（维持不变，新增仓位按执行价计算）  \n预期回报率：短期12%/中期31%（以当前价102,791为基准）  \n\n五、风险分析  \n1. 情绪过热风险：恐惧贪婪指数若突破75，立即启动5%仓位止盈，保留现金弹药  \n2. 流动性风险：日成交量连续3日低于30日均值20%时，减持10%仓位  \n3. 宏观冲击风险：美股VIX指数突破30时，启动防御性止损  \n\n六、未来观察指标  \n1. AHR999跌破0.95：触发预警，启动对冲策略（买入5%看跌期权）  \n2. 周线收盘突破105,000：确认新上涨趋势，追加5%仓位  \n3. 矿工持仓指数低于0.8：链上抛压信号，减持10%仓位  \n\n```json\n{\n  \"date\": \"2025-05-13\",\n  \"position\": 75,\n  \"position_change\": \"维持75%\",\n  \"action\": \"持有+区间操作\",\n  \"entry_price\": \"100,500-101,500(补仓) & 105,000(突破)\",\n  \"stop_loss\": 99800,\n  \"target_short\": 115000,\n  \"target_mid\": 135000,\n  \"cost_basis\": 82278,\n  \"expected_return\": \"12%-31%\",\n  \"market_cycle\": \"积累期/上升期过渡\",\n  \"risks\": [\"情绪过热\",\"流动性收缩\",\"宏观冲击\"],\n  \"key_levels\": [\"99800支撑\",\"105000阻力\",\"110000心理关口\"]\n}\n```",
  "advice_data": {
    "date": "2025-05-13",
    "position": 75,
    "position_change": "维持75%",
    "action": "持有+区间操作",
    "entry_price": "100,500-101,500(补仓) & 105,000(突破)",
    "stop_loss": 99800,
    "target_short": 115000,
    "target_mid": 135000,
    "cost_basis": 82278,
    "expected_return": "12%-31%",
    "market_cycle": "积累期/上升期过渡",
    "risks": [
      "情绪过热",
      "流动性收缩",
      "宏观冲击"
    ],
    "key_levels": [
      "99800支撑",
      "105000阻力",
      "110000心理关口"
    ]
  },
  "metadata": {
    "last_record_id": "BTI-20250512080152",
    "user_settings": {}
  }
}