{
  "id": "BTI-20250511080126",
  "timestamp": "20250511080126",
  "date": "2025-05-11",
  "recommendation": "一、市场周期分析  \n当前比特币价格在104,809美元附近震荡，较4月低点83,423美元反弹25.6%。AHR999指数1.1114处于估值适中区间（历史极值：2024年12月1.75/2025年4月0.67），恐惧贪婪指数70显示市场情绪偏向贪婪但未过热。价格突破100,000美元心理关口后，关键支撑上移至98,000-100,000美元区间，上方阻力在105,000美元（2025年3月多次测试未破）。综合判断市场处于上升期中期阶段。\n\n二、技术指标解读  \n1. 价格趋势：周线形成双底结构（2025-04-11低点83,423美元），短期均线（5日/10日）呈多头排列，但日线RSI（67）未超买  \n2. 市场估值：AHR999较2025-01-22历史峰值1.5294低27%，恐惧贪婪指数较2024-11-22极端贪婪值94更理性  \n3. 周期阶段：价格从2025年4月低点反弹超20%且站稳200日均线（约93,000），确认进入牛市中期  \n\n三、投资决策建议  \n1. 仓位调整：维持75%仓位（已达风险偏好上限），预留25%现金应对波动  \n2. 入场/出场价位：突破105,000美元加仓5%（使用500美元），回调至101,500-102,500补仓5%（剩余500美元）  \n3. 止损设置：动态止损上移至100,000美元（较当前价回撤4.6%），破位后等待98,000美元企稳再补仓  \n4. 获利目标：短期目标110,000（5%涨幅），中期目标125,000（19%涨幅），达短期目标后减仓10%锁定利润  \n\n四、仓位管理追踪  \n本次建议：突破105k加仓5% & 101.5k-102.5k补仓5%  \n仓位变化：维持75%  \n新成本基础：82,278美元（未执行加仓）  \n预期回报率：现价至125k达19.3%（未杠杆）  \n\n五、风险分析  \n1. 突破失败风险：若连续3日无法站稳105k，触发止盈10%仓位  \n2. 流动性紧缩风险：恐惧贪婪指数>80时减仓10%  \n3. 黑天鹅事件：跌破98k支撑位则启动对冲策略（买入5%反向ETF）  \n\n六、未来观察指标  \n1. 105,000美元：日收盘突破则加仓5%，确认新上升通道  \n2. AHR999<1.0：触发估值预警，启动网格交易（每跌2%买入2%）  \n3. 恐惧贪婪>80：触发情绪过热信号，减仓10%  \n\n```json\n{\n  \"date\": \"2025-05-11\",\n  \"position\": 75,\n  \"position_change\": \"维持75%\",\n  \"action\": \"持有\",\n  \"entry_price\": \"101,500-102,500(补仓) & 105,000(突破)\",\n  \"stop_loss\": 100000,\n  \"target_short\": 110000,\n  \"target_mid\": 125000,\n  \"cost_basis\": 82278,\n  \"expected_return\": \"19.3%\",\n  \"market_cycle\": \"上升期\",\n  \"risks\": [\"105k突破失败\", \"情绪过热\", \"宏观黑天鹅\"],\n  \"key_levels\": [\"105000\", \"100000\", \"98000\"]\n}\n```",
  "advice_data": {
    "date": "2025-05-11",
    "position": 75,
    "position_change": "维持75%",
    "action": "持有",
    "entry_price": "101,500-102,500(补仓) & 105,000(突破)",
    "stop_loss": 100000,
    "target_short": 110000,
    "target_mid": 125000,
    "cost_basis": 82278,
    "expected_return": "19.3%",
    "market_cycle": "上升期",
    "risks": [
      "105k突破失败",
      "情绪过热",
      "宏观黑天鹅"
    ],
    "key_levels": [
      "105000",
      "100000",
      "98000"
    ]
  },
  "metadata": {
    "last_record_id": "BTI-20250510080113",
    "user_settings": {}
  }
}