{
  "id": "BTI-20250526080112",
  "timestamp": "20250526080112",
  "date": "2025-05-26",
  "recommendation": "一、市场周期分析  \n当前市场处于积累期向上升期过渡阶段。价格从2025年4月低点76,322美元反弹超42%，近期在103,000-112,000美元形成震荡箱体。Ahr999指标1.15处于\"合理估值\"区间（历史牛市中位值1.2），恐惧贪婪指数73显示市场情绪偏乐观但未达极端贪婪（2025年1月曾达87）。关键支撑位105,000/103,000美元，阻力位112,000/115,000美元。\n\n二、技术指标解读  \n1. 价格趋势：20日均线（107,200）上穿50日均线（104,500）形成金叉，但连续5日未能突破112,000关键阻力  \n2. 市场估值：Ahr999较2025年1月峰值1.75回落34%，当前处于近6个月中位数水平。恐惧贪婪指数较上周下降11点显示短期过热风险缓解  \n3. 周期阶段：从2025年Q1的分配期（Ahr999>1.4）转入震荡积累，尚未确认新上升周期  \n\n三、投资决策建议  \n1. 仓位调整：维持64%仓位，保留36%现金应对波动  \n2. 入场/出场价位：  \n   - 突破112,000追涨10%仓位（使用预算500美元）  \n   - 回调至105,000-106,500区间分2批加仓（每下跌500美元加仓500美元）  \n3. 止损设置：移动止损上移至103,000（较现价-5.5%），触发后等待100,000企稳再入场  \n4. 获利目标：  \n   - 短期（3个月）目标118,000（+8.3%），达目标位减持20%仓位  \n   - 中期（12个月）目标145,000（+33%），突破125,000后启动趋势持仓  \n\n四、仓位管理追踪  \n本次建议：维持核心仓位，突破关键位追涨，回调分批建仓  \n仓位变化：64%→70%（若触发全部加仓条件）  \n新成本基础：89,532→91,420（含新增仓位）  \n预期回报率：按目标价计算短期+8.3%/中期+33%  \n\n五、风险分析  \n1. 假突破风险：若价格在112,000反复受阻，可能回调至98,000。应对：严格止损并暂停追涨  \n2. 情绪逆转风险：恐惧贪婪指数若突破80将进入危险区。应对：在指数≥80时减持10%仓位  \n3. 流动性风险：周末成交量下降20%，应对：加仓操作集中在UTC时间10:00-14:00主力交易时段  \n\n六、未来观察指标  \n1. Ahr999突破1.2：若连续3日高于该值，触发5%仓位止盈  \n2. 周线收于112,000上方：确认突破有效性，启动追涨策略  \n3. USDT溢价率：若出现>2%负溢价，立即减持10%仓位应对资金流出  \n\n```json\n{\n  \"date\": \"2025-05-26\",\n  \"position\": 64,\n  \"position_change\": \"维持64%\",\n  \"action\": \"持有+条件加仓\",\n  \"entry_price\": \"105,000-106,500分批/突破112,000追涨\",\n  \"stop_loss\": 103000,\n  \"target_short\": 118000,\n  \"target_mid\": 145000,\n  \"cost_basis\": 91420,\n  \"expected_return\": \"8.3%-33%\",\n  \"market_cycle\": \"积累期\",\n  \"risks\": [\"假突破风险\", \"情绪过热风险\", \"流动性不足风险\"],\n  \"key_levels\": [\"支撑105,000\", \"阻力112,000\", \"极端支撑98,000\"]\n}\n```",
  "advice_data": {
    "date": "2025-05-26",
    "position": 64,
    "position_change": "维持64%",
    "action": "持有+条件加仓",
    "entry_price": "105,000-106,500分批/突破112,000追涨",
    "stop_loss": 103000,
    "target_short": 118000,
    "target_mid": 145000,
    "cost_basis": 91420,
    "expected_return": "8.3%-33%",
    "market_cycle": "积累期",
    "risks": [
      "假突破风险",
      "情绪过热风险",
      "流动性不足风险"
    ],
    "key_levels": [
      "支撑105,000",
      "阻力112,000",
      "极端支撑98,000"
    ]
  },
  "metadata": {
    "last_record_id": "BTI-20250525080114",
    "user_settings": {}
  }
}