{
  "id": "BTI-20250515080120",
  "timestamp": "20250515080120",
  "date": "2025-05-15",
  "recommendation": "一、市场周期分析  \n当前处于分配期后期，价格在104,000附近震荡。关键支撑位99,800（前低）和97,500（4月低点延伸线），阻力位105,200（前高）。AHR999（1.0736）高于定投线（0.45）但低于泡沫线（1.2），估值中性偏高。恐惧贪婪指数70显示市场情绪\"贪婪\"，但未达极端值（历史峰值84），需警惕短期回调风险。\n\n二、技术指标解读  \n1. 价格趋势：30日价格波动率降至8%（4月为18%），100日均线（99,200）形成动态支撑，量能持续萎缩  \n2. 市场估值：AHR999处于近半年35%分位（峰值1.75在2025-01-17），恐惧贪婪指数较上月下降14点，过热压力缓解  \n3. 周期阶段：自2025-01历史高点（106,143）回撤22%后，进入震荡再平衡阶段  \n\n三、投资决策建议  \n1. 仓位调整：维持65%仓位（当前价格104,102接近成本82,278，浮盈26.5%）  \n2. 入场/出场价位：加仓区间102,300-103,500（占预算30%），减仓触发价108,800  \n3. 止损设置：跌破97,500全仓止损，若回升至100,800则恢复50%仓位  \n4. 获利目标：短期目标110,000（+5.6%），中期目标120,000（+15.2%），达目标后每上涨5%减仓10%  \n\n四、仓位管理追踪  \n本次建议：维持仓位，设置动态止盈  \n仓位变化：65% → 65%  \n新成本基础：82,278（未新增持仓）  \n预期回报率：短期5.6%/中期15.2%  \n\n五、风险分析  \n1. 矿工抛压风险：链上矿工持仓量降至1年低位，若持续减持可能跌破支撑 → 监控Glassnode矿工流出指标，单日净流出超5,000 BTC时启动对冲  \n2. 杠杆清算风险：永续合约资金费率0.01%（中性），但币安BTC多空比达2.1 → 价格跌破101,000时强制平仓10%仓位  \n3. 宏观流动性风险：10年期美债收益率突破4.5% → 触发条件达成时减仓至50%  \n\n六、未来观察指标  \n1. AHR999跌破1.0 → 启动每月500美元定额补仓  \n2. 恐惧贪婪指数＞75 → 自动触发5%仓位止盈  \n3. 周线收盘价＜99,800 → 执行止损并转为25% USDT+75% U本位合约对冲  \n\n```json\n{\n  \"date\": \"2025-05-15\",\n  \"position\": 65,\n  \"position_change\": \"维持0%\",\n  \"action\": \"持有\",\n  \"entry_price\": \"102,300-103,500\",\n  \"stop_loss\": 97500,\n  \"target_short\": 110000,\n  \"target_mid\": 120000,\n  \"cost_basis\": 82278,\n  \"expected_return\": \"5.6%-15.2%\",\n  \"market_cycle\": \"分配期\",\n  \"risks\": [\"矿工抛压\",\"杠杆清算\",\"美债收益率飙升\"],\n  \"key_levels\": [\"97500支撑\",\"105200阻力\",\"108800止盈触发\"]\n}\n```",
  "advice_data": {
    "date": "2025-05-15",
    "position": 65,
    "position_change": "维持0%",
    "action": "持有",
    "entry_price": "102,300-103,500",
    "stop_loss": 97500,
    "target_short": 110000,
    "target_mid": 120000,
    "cost_basis": 82278,
    "expected_return": "5.6%-15.2%",
    "market_cycle": "分配期",
    "risks": [
      "矿工抛压",
      "杠杆清算",
      "美债收益率飙升"
    ],
    "key_levels": [
      "97500支撑",
      "105200阻力",
      "108800止盈触发"
    ]
  },
  "metadata": {
    "last_record_id": "BTI-20250514080116",
    "user_settings": {}
  }
}