{
  "id": "BTI-20250501080121",
  "timestamp": "20250501080121",
  "date": "2025-05-01",
  "recommendation": "一、市场周期分析  \n当前市场处于积累期与上升期的过渡阶段。价格在88,000-96,500区间震荡1个月，关键阻力位96,500（4月多次测试未突破），支撑位88,000（4月21日低点）。AHR999指标0.9285低于1.0的牛熊分界线，估值处于合理区间（历史数据中1.5以上为泡沫区）。恐惧贪婪指数53显示中性情绪，较3月极端贪婪值84已显著降温。\n\n二、技术指标解读  \n1. 价格趋势：近5日价格波动收窄至93,700-95,000，形成三角形整理形态，200日均线（约89,200）提供动态支撑  \n2. 市场估值：当前AHR999处于近半年25%分位（2024年11月最低0.81），恐惧贪婪指数较1月高位回落40%，显示过热风险释放  \n3. 周期阶段：从分配期（2月AHR999峰值1.75）转入积累期，链上数据显示持币>1年地址占比持续上升至63%\n\n三、投资决策建议  \n1. 仓位调整：维持55%仓位（当前成本78,214，现价94,172已盈利20.5%）  \n2. 入场/出场：  \n   - 加仓区间：88,500-90,500（回调至30日均线）分2批投入500美元  \n   - 突破追涨：站稳96,500后追涨剩余500美元  \n3. 止损设置：严格维持87,000止损（较现价7.6%下行空间），若触发则等待85,000重新建仓  \n4. 获利目标：  \n   - 短期（3个月）：105,000（11.5%涨幅），触及后减仓10%  \n   - 中期（12个月）：120,000（27.4%涨幅），达目标位逐步止盈  \n\n四、仓位管理追踪  \n本次建议：维持仓位观察突破，保留45%现金等待关键位确认  \n仓位变化：55% → 55%（若触发加仓条件最高升至60%）  \n新成本基础：维持78,214（未触发加仓）或加权后82,300（全额执行加仓）  \n预期回报率：现价至120,000目标回报率27.4%（年化21.8%）  \n\n五、风险分析  \n1. 突破失败风险：连续3日收盘低于93,000将破坏整理结构 → 减仓10%并下调止损至90,000  \n2. 流动性收缩风险：若恐惧贪婪指数跌破40 → 启动对冲策略（用10%仓位买入季度看跌期权）  \n3. 监管风险：关注5月美国SEC加密货币听证会 → 持仓比例严守不超过总投资组合15%  \n\n六、未来观察指标  \n1. AHR999突破1.05：确认牛市重启 → 在97,000上方追涨5%仓位  \n2. 周线收破88,000：触发中期趋势反转 → 立即执行止损并转空头策略  \n3. 交易所净流入连续3日>2万BTC：抛压预警 → 启动5%预防性减仓  \n\n```json\n{\n  \"date\": \"2025-05-01\",\n  \"position\": 55,\n  \"position_change\": \"维持0%\",\n  \"action\": \"持有\",\n  \"entry_price\": \"88,500-90,500（回调）或突破96,500追涨\",\n  \"stop_loss\": 87000,\n  \"target_short\": 105000,\n  \"target_mid\": 120000,\n  \"cost_basis\": 78214,\n  \"expected_return\": \"27.4%\",\n  \"market_cycle\": \"积累期\",\n  \"risks\": [\"三角整理向下突破\", \"宏观流动性收紧\", \"监管政策变化\"],\n  \"key_levels\": [\"96,500阻力\", \"88,000支撑\", \"105,000斐波那契扩展位\"]\n}\n```",
  "advice_data": {
    "date": "2025-05-01",
    "position": 55,
    "position_change": "维持0%",
    "action": "持有",
    "entry_price": "88,500-90,500（回调）或突破96,500追涨",
    "stop_loss": 87000,
    "target_short": 105000,
    "target_mid": 120000,
    "cost_basis": 78214,
    "expected_return": "27.4%",
    "market_cycle": "积累期",
    "risks": [
      "三角整理向下突破",
      "宏观流动性收紧",
      "监管政策变化"
    ],
    "key_levels": [
      "96,500阻力",
      "88,000支撑",
      "105,000斐波那契扩展位"
    ]
  },
  "metadata": {
    "last_record_id": "BTI-20250430080125",
    "user_settings": {}
  }
}